name,price,img,rating,reviews_count,link,category,subcategory
1x4foot marble design bajry style waterproof PVC sheet fridge cabinet table all home decor,399,https://pk-live-21.slatic.net/kf/Sf182c85eb87f40f9913ef83880df5273I.jpg,,,N/A,furniture & decor,furniture
L-Shaped Sofa Set 6 Seater Corner Setty Molty Foam Turkish Design Customize in all sizes,55000,https://static-01.daraz.pk/p/82608615e50fb1e86010f70a722e187c.jpg,5.0,1,N/A,furniture & decor,furniture
High Quality Crystal Printed Sofa Covers- BEST QUALITY-ALL SIZES ARE AVAILABLE,899,https://static-01.daraz.pk/p/cf84ec158295c55db19835d8831f5ec0.jpg,5.0,1,N/A,furniture & decor,furniture
Customize dining or bedroom chair office chair solid wood frame imported leather rite all colours customize available,9500,https://static-01.daraz.pk/p/12ae26ed32b75be9b370743a6c747678.jpg,,,N/A,furniture & decor,furniture
furniture Polish Shiner Spray Bottle (Works on all color Furniture),499,https://pk-live-21.slatic.net/kf/Safe387521b114a078136005550aa2c6bp.jpg,,,N/A,furniture & decor,furniture
wardrobe with dressing table (all colors available),60000,https://pk-live-21.slatic.net/kf/Sf93043bdeccb4244a312a99ed25fd7f7O.jpg,,,N/A,furniture & decor,furniture
Bubble Sofa Covers/Stretchable Sofa Covers with Best Quality Anti Slip premium quality soft fabric 3/4/5/6/7 And  All sizes Available,7000,https://static-01.daraz.pk/p/4df687a946cad115de464cf566b2034b.png,,,N/A,furniture & decor,furniture
Dining chairs set Six dining chairs set in sheesham wood complete in polish six chairs plus table and acrylic table top all item customize available,62000,https://pk-live-21.slatic.net/kf/S2df36efe7ee9482390fd5571327e42d2Z.jpg,,,N/A,furniture & decor,furniture
Shizi Outdoor Rattan Set / waterproof furniture - Restaurant/Garden patio Dinning all weather chair/sofa dinning set,33999,https://static-01.daraz.pk/p/e1fdd80e759bd45fe95ffc82ae7af095.jpg,,,N/A,furniture & decor,furniture
Manipaidi 3in1 with all imported accessories | pedicure sofa set | manipaidi washing system,46500,https://pk-live-21.slatic.net/kf/S0bd0c2339f32413abc0640204b48f25db.jpg,,,N/A,furniture & decor,furniture
Blue Shade Net | BEST QUAILITY GAURANTEED | All sizes available,900,https://static-01.daraz.pk/p/6cff94b2978ff9f3ce9ef1dca29c62f3.jpg,,,N/A,furniture & decor,furniture
"Barber & Cutting Chairs,All Furniture,Makeup & Styling Chairs,ChairsIn Stock",28000,https://static-01.daraz.pk/p/0388e83806c2310f78455ea1e8f5ce03.jpg,,,N/A,furniture & decor,furniture
Bed saide table unique modren style all design bed attach,5999,https://pk-live-21.slatic.net/kf/Se039edfcf4a6439da72a04d9aea63cd18.jpg,,,N/A,furniture & decor,furniture
Customizable in All Size For Your Room and all colors L and U  Shape Corner Sofa Set Without puffy,150000,https://static-01.daraz.pk/p/f4d7f851b49c7f1e62fcbc53fbb3125c.jpg,,,N/A,furniture & decor,furniture
Table leg metal black mate all table consoule,900,https://pk-live-21.slatic.net/kf/See2400bf88c54bdd83b75765e84a6961Y.jpg,,,N/A,furniture & decor,furniture
rocking chair Easy chair sleeping resting chair all colour customised available,24500,https://pk-live-21.slatic.net/kf/S8fb477ffe812417c9ffdbc956997e885e.jpg,,,N/A,furniture & decor,furniture
TV Cabinet With Shelf  In All colors,4999,https://pk-live-21.slatic.net/kf/S8804a3d172e2490cb3e12e7e9e0ed3f0H.jpg,2.5,2,N/A,furniture & decor,furniture
Anti Slip Anti Dust Turkish Style Sofa Covers in Soft Knitted Cotton Mash Fabric | All Sizes are Available - Choose Size from Options | Premium Quality,5000,https://static-01.daraz.pk/p/63bb3c31b77e8049f900eab192d964e2.jpg,,,N/A,furniture & decor,furniture
school chairs two variation available (all colors available),3000,https://pk-live-21.slatic.net/kf/S88c6bf8e181247679062852593da8426e.jpg,,,N/A,furniture & decor,furniture
six chairs dinning chairs set imported fabric 10 years guarantee foam and structure all colours customize available,85000,https://pk-live-21.slatic.net/kf/S858f93cb4c3f4a5aae6a791c190e721ei.jpg,,,N/A,furniture & decor,furniture
"High Quality Ultrasonic Micro Fabric Cotton Quilted Sofa Covers, Cotton Quilted Sofa Covers- BEST QUALITY-ALL SIZES ARE AVAILABLE",680,https://static-01.daraz.pk/p/adee1f15162d7975db8a0c111e238816.jpg,,,N/A,furniture & decor,furniture
Sofa covers all sets (6 seater )(high quality Turkish cover,4000,https://pk-live-21.slatic.net/kf/S27196ff4d53e432e93d861837b0d4c69l.jpg,,,N/A,furniture & decor,furniture
customize Sofa three seater with seaty 3 seater sofa plus seaty all colours customize available,52000,https://pk-live-21.slatic.net/kf/Sb5f3842da1f44614ae872a770bf17bc3H.jpg,,,N/A,furniture & decor,furniture
Customize Dining chair  six chairs with table all colours customize available woth table,80000,https://pk-live-21.slatic.net/kf/S066bf3626bd54301bfd03ec614ec56f3g.jpg,,,N/A,furniture & decor,furniture
customize Royal bedroom chairs set 10 years guarantee foam and structure imported fabric all colours customize available,44999,https://static-01.daraz.pk/p/8e82846122f581fd73e529305d728a4c.jpg,,,N/A,furniture & decor,furniture
kid's bed without mattress ( all colors available),14000,https://pk-live-21.slatic.net/kf/Sd81b0313ce2f40c0ae69c9a4b942bf1bq.jpg,,,N/A,furniture & decor,furniture
"Stretchable Sofa Covers for 7 seater (3+2+1+1), jersey fabric , Elastic Sofa Cover , Free Size , Fit to all Sofa , Standard Size, Dark Brown",3290,https://static-01.daraz.pk/p/cd1145e78b333621bf22a7796278273f.jpg,5.0,1,N/A,furniture & decor,furniture
customize six seater L shape sofa 10 years guarantee foam and structure all colours available,75000,https://static-01.daraz.pk/p/450cb93091fef5ef9a3e0c72a4d9df46.jpg,,,N/A,furniture & decor,furniture
Shizi Balcony Chairs & Table Outdoor Rattan Coffee table/Cane/Wicker waterproof furniture - Restaurant/Garden patio Dinning all weather chair/sofa dinning set- Restaurant furniture,24999,https://static-01.daraz.pk/p/c469dabdbe6ecf8bb7597af9fce44adc.jpg,,,N/A,furniture & decor,furniture
Customize seven seater sofa set 3+1+1+2 seater seaty all colours available master foam 10 years guarantee imported fabric,96000,https://pk-live-21.slatic.net/kf/S7e2805cd8f29400c926bfabee70173c9v.jpg,,,N/A,furniture & decor,furniture
Customize Chairs Dining dining chairs set four chairs plus table acrylic marble top 10 years guarantee foam and structure all colours customize available,55000,https://pk-live-21.slatic.net/kf/Sf0feefa1aadf49f79cfa728dbae67c8bL.jpg,,,N/A,furniture & decor,furniture
Sofa customize sofa plus double bed 10 years guarantee foam and structure all colours customize available two in one aofa plus double bed,99999,https://pk-live-21.slatic.net/kf/Sbc7ec0ef0d4a4a43bffe471b73ddac466.jpg,,,N/A,furniture & decor,furniture
wardrobe kids wardrobe two door almari all colors customize available,36000,https://pk-live-21.slatic.net/kf/Sea5fcca5471844a69293a6f99f82acacF.jpg,,,N/A,furniture & decor,furniture
"High Quality Ultrasonic Micro Fabric Cotton Quilted Sofa Covers, Cotton Quilted Sofa Covers- BEST QUALITY-ALL SIZES ARE AVAILABLE",659,https://static-01.daraz.pk/p/1b25e69be96470a973508b2af0c8248e.jpg,,,N/A,furniture & decor,furniture
two seater seaty 10 years guarantee foam and structure all colours available,12999,https://pk-live-21.slatic.net/kf/Scf89dac10d6e40c39e205ac586e440c6D.jpg,,,N/A,furniture & decor,furniture
RHS Online Bed Headboard Cover All-inclusive Elasticity Bedside Back Cover Solid Wood Leather Bed Soft Bag Dust Cover,2599,https://static-01.daraz.pk/p/41d657a9cc0c0ae735ce4c958c144d0c.jpg,,,N/A,furniture & decor,furniture
two seater seaty 10 years guarantee foam and structure all colours available,12999,https://static-01.daraz.pk/p/9b8de519770a7b6e7da5579f94f3e907.jpg,,,N/A,furniture & decor,furniture
customize two seater sofa seaty all colours available,12999,https://pk-live-21.slatic.net/kf/Sb62c317950504983a239e66efdea40165.jpg,,,N/A,furniture & decor,furniture
Waterproof Quilted Sofa Cover - Copper Brown - All Sizes,2000,https://static-01.daraz.pk/p/85e2a07222bc1515cc86553b1e32903c.jpg,,,N/A,furniture & decor,furniture
wardrobe Almari kids almari two door lemination wood all colours customize available,35000,https://pk-live-21.slatic.net/kf/Sc599ddc996114d1c89db3f77003d448d1.jpg,,,N/A,furniture & decor,furniture
Hight Quality Crystal Printed Sofa Cover-Best Quality-All Sizes are /Avaliable,899,https://static-01.daraz.pk/p/d899ec19f0717daf83cccd58d79cabe1.jpg,,,N/A,furniture & decor,furniture
four chairs plus dining table in fabric premium quality wood 10 years guarantee foam and structure all colours customize available by,100000,https://pk-live-21.slatic.net/kf/S5f1e67b21a5844e69d6f9d78c03d8c6cW.jpg,,,N/A,furniture & decor,furniture
Two seater seaty puffy for your living room bedroom dining room  all colours customize available beautifully designed for you,18999,https://pk-live-21.slatic.net/kf/S7e40c24b42de482fae42263eb27d1af22.jpg,,,N/A,furniture & decor,furniture
Customizable in All Colors Premium Sofa Set 5 and 7 Seater Enhance Your Room Look Luxurious Velvet Crown Sofa The Epitome of Elegance and Comfort,65000,https://static-01.daraz.pk/p/88558ef01e571f56d5654e64faaf2c8a.jpg,,,N/A,furniture & decor,furniture
Printed Quilted Sofa Coat Cover - Cotton Sofa Runner- BEST QUALITY-ALL SIZES ARE AVAILABLE,585,https://static-01.daraz.pk/p/223c3038a5069fa789c6b4ab11a0826e.jpg,5.0,1,N/A,furniture & decor,furniture
4 Seater Puffy Sofa best for Bedroom launch and drawing Room best material 5 years guarantee all colors,17000,https://static-01.daraz.pk/p/15d3532e6d733a21ed1b48a080ee8909.jpg,,,N/A,furniture & decor,furniture
stylish 2 seater sofa all colors available,18000,https://pk-live-21.slatic.net/kf/Se43e4eabd1ec4fe390d02d7ed880cfd7H.jpg,,,N/A,furniture & decor,furniture
Customizable in All Colors Premium Sofa Set 5 and 7 Seater Enhance Your Room Look Luxurious Velvet Crown Sofa The Epitome of Elegance and Comfort,64999,https://static-01.daraz.pk/p/430de4d6e9a75d87e9a38bec34e52937.jpg,,,N/A,furniture & decor,furniture
Adjustable arms for all kind of Revolving Chairs,6500,https://static-01.daraz.pk/p/7f965681dd469f3ce3ca434f7520f4c9.jpg,5.0,1,N/A,furniture & decor,furniture
4 Seater Puffy Set Sofa Malai velvet 7 years guarantee Sale all customize colors,16799,https://static-01.daraz.pk/p/f0e42c06556ed337d374a0d57bdd1ec8.jpg,,,N/A,furniture & decor,furniture
Customized Two seater seaty puffy for your living room bedroom dining room  all colours customize available beautifully designed for you,19999,https://pk-live-21.slatic.net/kf/S1620ac57a3584444a5c9efcbf0334505r.jpg,,,N/A,furniture & decor,furniture
"Premium,Heavy Duty,Sleek and Stylish Black Caster Wheels Available In All Sizes Hardware 4 Pieces Set 2 With Brakes 2 Without Brakes",799,https://static-01.daraz.pk/p/6c8af05993f2e9693f37bb51e381b12a.jpg,,,N/A,furniture & decor,furniture
Saide Table All Bed Saize Beautyfull Slim Design,5999,https://pk-live-21.slatic.net/kf/S555f6195912147f59d7619c7f67cbf61L.jpg,,,N/A,furniture & decor,furniture
customize six seater L shape sofa 10 years guarantee foam and structure all colours available,75000,https://pk-live-21.slatic.net/kf/S830ffd3e90b14d968717b4afaba56518w.jpg,,,N/A,furniture & decor,furniture
Quilted Sofa Cover - Skin - All Seaters,2000,https://static-01.daraz.pk/p/0be7126242dbb75f7bd928dfb464d43f.jpg,,,N/A,furniture & decor,furniture
Wheel Caster For All Kinds Of Revolving Chairs Trolly Wheel Tyre Casters Wheel Office Chair Tyres Computer Chair Single Piece,799,https://static-01.daraz.pk/p/bbf09c3bb2cd225df92fcb24a35933ee.jpg,5.0,2,N/A,furniture & decor,furniture
customize Dining chair One chair dining all design available sheesham wood  polish,8499,https://pk-live-21.slatic.net/kf/Sb4e3a6883e3544cba6b15b2b71e2e5a5Q.jpg,,,N/A,furniture & decor,furniture
wheels / casters - set of 5 - for all kinds of revolving chairs,1100,https://static-01.daraz.pk/p/122c55a57b84bcb955bd8e02fb2c29dc.jpg,,,N/A,furniture & decor,furniture
school tables two variations available (all colors available),3500,https://pk-live-21.slatic.net/kf/S3d594c9d97ed49f7836f4655886998029.jpg,,,N/A,furniture & decor,furniture
Creative design wall Key holder for hanging all kind of keys and for putting beautiful figurines for home Decoration,1199,https://pk-live-21.slatic.net/kf/S52cab9c1257c422085c85d1b3e920501L.jpg,4.6,5,N/A,furniture & decor,furniture
Waterproof Quilted Sofa Cover - Dark Brown - All Sizes,2000,https://static-01.daraz.pk/p/3031f54afeff51ca6823c728185101a9.jpg,,,N/A,furniture & decor,furniture
Sofa set 5 seaters diamond foam 12 Year warranty All colors available coustimez,58999,https://static-01.daraz.pk/p/e2d29ca5dfdaf565e60811186f23228d.jpg,5.0,1,N/A,furniture & decor,furniture
*Wardrobe Style Racks (5Layer)*(Box Packing) Random Colours,2345,https://static-01.daraz.pk/p/d74a062c99b04e66b48c96fa4ff8a753.jpg,,,N/A,furniture & decor,furniture
Customize dining or bedroom chair office chair solid wood frame imported leather rite all colours customize available,9500,https://static-01.daraz.pk/p/12ae26ed32b75be9b370743a6c747678.jpg,,,N/A,furniture & decor,furniture
Customizable Premium Sofa Set available in all colors,60200,https://static-01.daraz.pk/p/64697e44797614bc743392075293f049.jpg,,,N/A,furniture & decor,furniture
Stylish Puffy Sofa Seater Customize in all colors with Free 1 Cushion,6999,https://static-01.daraz.pk/p/67921b3a714e6beb7b21a863999bef12.jpg,,,N/A,furniture & decor,furniture
customized bedroom chairs set with table 10 years guarantee foam and structure all colours customize available,43500,https://pk-live-21.slatic.net/kf/Sf50c1970e00747beaba6b38c32686f8bd.jpg,,,N/A,furniture & decor,furniture
Customizable Premium Sofa Set available in all colors,55000,https://static-01.daraz.pk/p/2638f40366cbdc94589598363bd001f1.jpg,,,N/A,furniture & decor,furniture
Dining chair with table eight chairs all colours customize available,125000,https://static-01.daraz.pk/p/6b7b99abc0dc7663c81e478424e58033.jpg,,,N/A,furniture & decor,furniture
dining chair only one chair customize made all colours customize available solid wood frame highly premium quality fabric and foam 10 years guarantee foam and structure ( color apni marzi ka chat mai confirm karen),13000,https://static-01.daraz.pk/p/42903ab7fba2afe529e7b2b68f281015.jpg,,,N/A,furniture & decor,furniture
ELEGANT Sethi luxury sofa fabric Velvet Customize furniture all Colours with 7 years warranty,9998,https://static-01.daraz.pk/p/441d1abc646d3b67bcc4803f6308abe7.jpg,,,N/A,furniture & decor,furniture
customize Royal bedroom chairs set 10 years guarantee foam and structure imported fabric all colours customize available,44999,https://static-01.daraz.pk/p/8e82846122f581fd73e529305d728a4c.jpg,,,N/A,furniture & decor,furniture
"Table leg 18""inch 4 peces for all coffee table center table",3499,https://pk-live-21.slatic.net/kf/See5c422febae4bacb7cd79bbb065da30z.jpg,,,N/A,furniture & decor,furniture
【BestGO】Nordic Style Fabric Bedside Cover All-inclusive Bedside Cover Bedside Dust Cover Protects The Bedside Back Cover 1.2 / 1.5 / 2.0 / 1.8 / 2 / 0m Bedside,4291,https://static-01.daraz.pk/p/55444f09457d6f6ee16257fd2d6a6b73.jpg,,,N/A,furniture & decor,furniture
pafi sofa set all colors available for reasonable price !!,10000,https://pk-live-21.slatic.net/kf/S6b12835d768f494f9abf40730dbf85435.jpg,,,N/A,furniture & decor,furniture
Customizable in All Colors Premium Sofa Set 5 and 7 Seater Enhance Your Room Look Luxurious Velvet Crown Sofa The Epitome of Elegance and Comfort,74200,https://static-01.daraz.pk/p/74883e58b9f0696e586c63ac525fc1f9.jpg,,,N/A,furniture & decor,furniture
Customizable in All Size For Your Room and all colors L and U  Shape Corner Sofa Set on Demand,52000,https://static-01.daraz.pk/p/889e512a80f541b5be3fd9805c9d7af6.png,5.0,10,N/A,furniture & decor,furniture
storage seaty sofa four seater set in velvet fabric all colours available,20400,https://pk-live-21.slatic.net/kf/S300c5a4dd24345bfa53ce61fd12cf299O.jpg,,,N/A,furniture & decor,furniture
Sofa Cover All sizes available High Quality,3200,https://static-01.daraz.pk/p/a9ec9cc962caddd5fb9e5b95a23d44a9.jpg,,,N/A,furniture & decor,furniture
customize only one chair dining chair imported quality foam and fabric all color customize available,12000,https://pk-live-21.slatic.net/kf/S3dc52495fcd646a6925103ebf9b4d7c7X.jpg,,,N/A,furniture & decor,furniture
Hight Quality Crystal Printed Sofa Cover-Best Quality-All Sizes are /Avaliable,899,https://static-01.daraz.pk/p/d899ec19f0717daf83cccd58d79cabe1.jpg,,,N/A,furniture & decor,furniture
four chairs plus dining table in fabric premium quality wood 10 years guarantee foam and structure all colours customize available by,100000,https://pk-live-21.slatic.net/kf/S5f1e67b21a5844e69d6f9d78c03d8c6cW.jpg,,,N/A,furniture & decor,furniture
Two seater seaty puffy for your living room bedroom dining room  all colours customize available beautifully designed for you,18999,https://pk-live-21.slatic.net/kf/S7e40c24b42de482fae42263eb27d1af22.jpg,,,N/A,furniture & decor,furniture
Customizable in All Colors Premium Sofa Set 5 and 7 Seater Enhance Your Room Look Luxurious Velvet Crown Sofa The Epitome of Elegance and Comfort,65000,https://static-01.daraz.pk/p/88558ef01e571f56d5654e64faaf2c8a.jpg,,,N/A,furniture & decor,furniture
Printed Quilted Sofa Coat Cover - Cotton Sofa Runner- BEST QUALITY-ALL SIZES ARE AVAILABLE,585,https://static-01.daraz.pk/p/223c3038a5069fa789c6b4ab11a0826e.jpg,5.0,1,N/A,furniture & decor,furniture
4 Seater Puffy Sofa best for Bedroom launch and drawing Room best material 5 years guarantee all colors,17000,https://static-01.daraz.pk/p/15d3532e6d733a21ed1b48a080ee8909.jpg,,,N/A,furniture & decor,furniture
stylish 2 seater sofa all colors available,18000,https://pk-live-21.slatic.net/kf/Se43e4eabd1ec4fe390d02d7ed880cfd7H.jpg,,,N/A,furniture & decor,furniture
Customizable in All Colors Premium Sofa Set 5 and 7 Seater Enhance Your Room Look Luxurious Velvet Crown Sofa The Epitome of Elegance and Comfort,64999,https://static-01.daraz.pk/p/430de4d6e9a75d87e9a38bec34e52937.jpg,,,N/A,furniture & decor,furniture
Adjustable arms for all kind of Revolving Chairs,6500,https://static-01.daraz.pk/p/7f965681dd469f3ce3ca434f7520f4c9.jpg,5.0,1,N/A,furniture & decor,furniture
4 Seater Puffy Set Sofa Malai velvet 7 years guarantee Sale all customize colors,16799,https://static-01.daraz.pk/p/f0e42c06556ed337d374a0d57bdd1ec8.jpg,,,N/A,furniture & decor,furniture
Customized Two seater seaty puffy for your living room bedroom dining room  all colours customize available beautifully designed for you,19999,https://pk-live-21.slatic.net/kf/S1620ac57a3584444a5c9efcbf0334505r.jpg,,,N/A,furniture & decor,furniture
"Premium,Heavy Duty,Sleek and Stylish Black Caster Wheels Available In All Sizes Hardware 4 Pieces Set 2 With Brakes 2 Without Brakes",799,https://static-01.daraz.pk/p/6c8af05993f2e9693f37bb51e381b12a.jpg,,,N/A,furniture & decor,furniture
Saide Table All Bed Saize Beautyfull Slim Design,5999,https://pk-live-21.slatic.net/kf/S555f6195912147f59d7619c7f67cbf61L.jpg,,,N/A,furniture & decor,furniture
customize six seater L shape sofa 10 years guarantee foam and structure all colours available,75000,https://pk-live-21.slatic.net/kf/S830ffd3e90b14d968717b4afaba56518w.jpg,,,N/A,furniture & decor,furniture
Quilted Sofa Cover - Skin - All Seaters,2000,https://static-01.daraz.pk/p/0be7126242dbb75f7bd928dfb464d43f.jpg,,,N/A,furniture & decor,furniture
Wheel Caster For All Kinds Of Revolving Chairs Trolly Wheel Tyre Casters Wheel Office Chair Tyres Computer Chair Single Piece,799,https://static-01.daraz.pk/p/bbf09c3bb2cd225df92fcb24a35933ee.jpg,5.0,2,N/A,furniture & decor,furniture
customize Dining chair One chair dining all design available sheesham wood  polish,8499,https://pk-live-21.slatic.net/kf/Sb4e3a6883e3544cba6b15b2b71e2e5a5Q.jpg,,,N/A,furniture & decor,furniture
wheels / casters - set of 5 - for all kinds of revolving chairs,1100,https://static-01.daraz.pk/p/122c55a57b84bcb955bd8e02fb2c29dc.jpg,,,N/A,furniture & decor,furniture
school tables two variations available (all colors available),3500,https://pk-live-21.slatic.net/kf/S3d594c9d97ed49f7836f4655886998029.jpg,,,N/A,furniture & decor,furniture
Creative design wall Key holder for hanging all kind of keys and for putting beautiful figurines for home Decoration,1199,https://pk-live-21.slatic.net/kf/S52cab9c1257c422085c85d1b3e920501L.jpg,4.6,5,N/A,furniture & decor,furniture
Waterproof Quilted Sofa Cover - Dark Brown - All Sizes,2000,https://static-01.daraz.pk/p/3031f54afeff51ca6823c728185101a9.jpg,,,N/A,furniture & decor,furniture
Sofa set 5 seaters diamond foam 12 Year warranty All colors available coustimez,58999,https://static-01.daraz.pk/p/e2d29ca5dfdaf565e60811186f23228d.jpg,5.0,1,N/A,furniture & decor,furniture
*Wardrobe Style Racks (5Layer)*(Box Packing) Random Colours,2345,https://static-01.daraz.pk/p/d74a062c99b04e66b48c96fa4ff8a753.jpg,,,N/A,furniture & decor,furniture
Customize dining or bedroom chair office chair solid wood frame imported leather rite all colours customize available,9500,https://static-01.daraz.pk/p/12ae26ed32b75be9b370743a6c747678.jpg,,,N/A,furniture & decor,furniture
Customizable Premium Sofa Set available in all colors,60200,https://static-01.daraz.pk/p/64697e44797614bc743392075293f049.jpg,,,N/A,furniture & decor,furniture
Stylish Puffy Sofa Seater Customize in all colors with Free 1 Cushion,6999,https://static-01.daraz.pk/p/67921b3a714e6beb7b21a863999bef12.jpg,,,N/A,furniture & decor,furniture
customized bedroom chairs set with table 10 years guarantee foam and structure all colours customize available,43500,https://pk-live-21.slatic.net/kf/Sf50c1970e00747beaba6b38c32686f8bd.jpg,,,N/A,furniture & decor,furniture
Customizable Premium Sofa Set available in all colors,55000,https://static-01.daraz.pk/p/2638f40366cbdc94589598363bd001f1.jpg,,,N/A,furniture & decor,furniture
Dining chair with table eight chairs all colours customize available,125000,https://static-01.daraz.pk/p/6b7b99abc0dc7663c81e478424e58033.jpg,,,N/A,furniture & decor,furniture
dining chair only one chair customize made all colours customize available solid wood frame highly premium quality fabric and foam 10 years guarantee foam and structure ( color apni marzi ka chat mai confirm karen),13000,https://static-01.daraz.pk/p/42903ab7fba2afe529e7b2b68f281015.jpg,,,N/A,furniture & decor,furniture
ELEGANT Sethi luxury sofa fabric Velvet Customize furniture all Colours with 7 years warranty,9998,https://static-01.daraz.pk/p/441d1abc646d3b67bcc4803f6308abe7.jpg,,,N/A,furniture & decor,furniture
customize Royal bedroom chairs set 10 years guarantee foam and structure imported fabric all colours customize available,44999,https://static-01.daraz.pk/p/8e82846122f581fd73e529305d728a4c.jpg,,,N/A,furniture & decor,furniture
"Table leg 18""inch 4 peces for all coffee table center table",3499,https://pk-live-21.slatic.net/kf/See5c422febae4bacb7cd79bbb065da30z.jpg,,,N/A,furniture & decor,furniture
【BestGO】Nordic Style Fabric Bedside Cover All-inclusive Bedside Cover Bedside Dust Cover Protects The Bedside Back Cover 1.2 / 1.5 / 2.0 / 1.8 / 2 / 0m Bedside,4291,https://static-01.daraz.pk/p/55444f09457d6f6ee16257fd2d6a6b73.jpg,,,N/A,furniture & decor,furniture
pafi sofa set all colors available for reasonable price !!,10000,https://pk-live-21.slatic.net/kf/S6b12835d768f494f9abf40730dbf85435.jpg,,,N/A,furniture & decor,furniture
Customizable in All Colors Premium Sofa Set 5 and 7 Seater Enhance Your Room Look Luxurious Velvet Crown Sofa The Epitome of Elegance and Comfort,74200,https://static-01.daraz.pk/p/74883e58b9f0696e586c63ac525fc1f9.jpg,,,N/A,furniture & decor,furniture
Customizable in All Size For Your Room and all colors L and U  Shape Corner Sofa Set on Demand,52000,https://static-01.daraz.pk/p/889e512a80f541b5be3fd9805c9d7af6.png,5.0,10,N/A,furniture & decor,furniture
storage seaty sofa four seater set in velvet fabric all colours available,20400,https://pk-live-21.slatic.net/kf/S300c5a4dd24345bfa53ce61fd12cf299O.jpg,,,N/A,furniture & decor,furniture
Sofa Cover All sizes available High Quality,3200,https://static-01.daraz.pk/p/a9ec9cc962caddd5fb9e5b95a23d44a9.jpg,,,N/A,furniture & decor,furniture
customize only one chair dining chair imported quality foam and fabric all color customize available,12000,https://pk-live-21.slatic.net/kf/S3dc52495fcd646a6925103ebf9b4d7c7X.jpg,,,N/A,furniture & decor,furniture
Hight Quality Crystal Printed Sofa Cover-Best Quality-All Sizes are /Avaliable,899,https://static-01.daraz.pk/p/d899ec19f0717daf83cccd58d79cabe1.jpg,,,N/A,furniture & decor,furniture
four chairs plus dining table in fabric premium quality wood 10 years guarantee foam and structure all colours customize available by,100000,https://pk-live-21.slatic.net/kf/S5f1e67b21a5844e69d6f9d78c03d8c6cW.jpg,,,N/A,furniture & decor,furniture
Two seater seaty puffy for your living room bedroom dining room  all colours customize available beautifully designed for you,18999,https://pk-live-21.slatic.net/kf/S7e40c24b42de482fae42263eb27d1af22.jpg,,,N/A,furniture & decor,furniture
Customizable in All Colors Premium Sofa Set 5 and 7 Seater Enhance Your Room Look Luxurious Velvet Crown Sofa The Epitome of Elegance and Comfort,65000,https://static-01.daraz.pk/p/88558ef01e571f56d5654e64faaf2c8a.jpg,,,N/A,furniture & decor,furniture
Printed Quilted Sofa Coat Cover - Cotton Sofa Runner- BEST QUALITY-ALL SIZES ARE AVAILABLE,585,https://static-01.daraz.pk/p/223c3038a5069fa789c6b4ab11a0826e.jpg,5.0,1,N/A,furniture & decor,furniture
4 Seater Puffy Sofa best for Bedroom launch and drawing Room best material 5 years guarantee all colors,17000,https://static-01.daraz.pk/p/15d3532e6d733a21ed1b48a080ee8909.jpg,,,N/A,furniture & decor,furniture
